"Get Started with Salesforce DX | Salesforce Trailhead #TDX17",info
"Introducing the Salesforce DX Open Beta    Sent from FeedLab",info
"Introducing the Salesforce DX Open Beta - Developer Relations",info
"Introducing the #Salesforce DX Open Beta - Developer Relations",info
"Managed Packages in Salesforce DX and Feature Management:  via",info
"Learn how #SalesforceDX is transforming Salesforce development",info
"Salesforce DX is now Open Beta. See this post to get more info",info
"Demo of SalesforceDX by  #salesforce #ohana #meetup #ahmedabad",info
"Introducing the #Salesforce DX Open Beta - Developer Relations",info
"Selenium and SalesforceDX Scratch Orgs  Bob Buzzard #Salesforce",info
"Introducing the Salesforce DX Open Beta - Developer Relations -",info
"New #Trailhead trail for the  -  Get Started with Salesforce DX",info
"Build together and deliver continuously...with the salesforceDX",info
"Analyst briefing from this morning on #SalesforceDX with  and .",info
"It's official #salesforcedx is open beta #TDX17 opening keynote",info
"New Object Metadata .... More Classified   #Salesforcedx #TDX17",info
"Salesforce DX  Jenkins  Jenkinsfile Revisited  Brett #Salesforce",info
"Salesforce DX  Jenkins  Environment Variables  Brett #Salesforce",info
"Introducing the Salesforce DX Open Beta  Wade Wegner #Salesforce",info
"Modern Application Development with #SalesforceDX and     #TDX17",info
"Introduction to Salesforce DX  Salesforce Developers #Salesforce",info
"Salesforce Lightning Testing Service Part 1 by      #SalesforceDX",info
"Check out the new #SalesforceDX  trails. #tdx17",info
"App development with Salesforce DX. #TrailheaDX",info
"Liked on YouTube: Introduction to Salesforce DX",info
"Change the way you build apps with #SalesforceDX",info
"One of the best agenda for the day #SalesforceDX",info
"#NewProfilePic #tdx17 #SalesforceDX #TrailBlazer",info
"is a Summit Sponsor for . #automate #NoDeployment",info
"A great take on #SalesforceDX and platform from .",info
"#SalesforceTour London - #DevTrails #salesforcedx",info
"is presenting about #SalesforceDX at #AhmedabadDUG",info
"How to get started on #SalesforceDX #TDX17 #TDF2017",info
"Modern Application Development with Salesforce DX -",info
"Here's the session link to  session at #TrailheaDX #TDX17   #SalesforceDX",info
"Discussion on continuous integration and continous delivery #salesforcedx",info
"Very timely with advent of #salesforcedx must learn for the next level of",info
"Introducing the Salesforce DX Open Beta - Developer Relations  #salesforce",info
"Boost Developer Productivity with Salesforce DX CLI Customized Tools:  via",info
"#TrailheadX is over. Salesforce DX Beta announced. I'm still alive though.",info
"We blogged about DX at the start of the pilot  with our thoughts and plans",info
"Get  's take on #TrailheaDX  #SalesforceDX #EinsteinAI  Platform Events  __",info
"kicking off the dev event in Boston. Talking on SalesforceDx  #SalesforceDx",info
"sharing about the power of #SalesforceDX and open beta for all Devs. #TDX17",info
"brings productivity to our Developers. Meet  the Modern Way to Build on the",info
"Salesforce DX  Automatically Deploy Apex and Visualforce  Brett #Salesforce",info
"leading a crowd down CI #devTrails at #SalesforceTours London. #SalesforceDX",info
"We use Developer Edition orgs but of course moving to Scratch orgs which can",info
"Salesforce DX  Automatically Deploy Apex and Visualforce   #Gulp #Salesforce",info
"Our very own  will be speaking about the  DX pilot AND giving a live demo at",info
"[VIDEO] 's Chief Architect  on stage earlier today with  at  #TDX17 talking a",info
"Just published a new article: Salesforce DX  Setup  #SalesforceDX #Salesforce",info
"great SalesforceDX session today in #EssentialsMadrid more than 60 attendees.",info
"#salesforcedx  could revolutionise the development cycle #salesforceworldtour",info
"Salesforce DX  Setup Jenkins   #Salesforce #SalesforceDeveloper #SalesforceDX",info
"Creating Scratch Org in Salesforce DX from API using JSforce - JSforce #TDX17",info
"And we can see the if has the default page template  #SalesforceDX #Salesforce",info
"Meet  DX the Modern Way to Build on the Salesforce Platform - Now in Open Beta",info
"Commandand see what happens: sfdx force:source:push  #Salesforce #SalesforceDX",info
"Around the Web 20170630   #Angular #Lightning #Salesforce #SalesforceDeveloper",info
"Everything is driven by source code - Salesforce DX   #TDX17 #dev #programming",info
"Latest From #SFDC Developer Relations: Introducing the Salesforce DX Open Beta",info
"Just published a new article: Salesforce DX  Using Existing Source  #Salesforce",info
"Get started learning with the brand new Trailhead trail covering Salesforce DX:",info
"Salesforce DX  Static Resources  #Salesforce #SalesforceDX #SalesforceDeveloper",info
"Meet  DX the Modern Way to Build on the #Salesforce Platform - Now in Open Beta",info
"We will support #salesforcedx for sure. The first release of it we will show on",info
"Salesforce DX  Creating Things   #Salesforce #SalesforceDeveloper #SalesforceDX",info
"on fire _ here at #TDX17 Kickong things off with a SalesforceDX Analyst Session",info
"Retrieve Unpackage Source By Creating a Temporary Unmanaged Package  #Salesforce",info
"Salesforce DX - Creating Things - #Salesforce #SalesforceDeveloper #SalesforceDX",info
"Dont miss this #SalesforceApexHours if you want to know more about #SalesforceDX",info
"FYI I'm actively integrating #SalesforceDX and . Keep an eye on  for details and",info
"Salesforce DX  Creating Things -  #Salesforce #SalesforceDeveloper #SalesforceDX",info
"It would probably help if I included the link:  #TrailheaDX #TDX17 #SalesforceDX",info
"Continuous Integration with Salesforce DX is incredible! Get it here  #TrailheaDX",info
"#SalesforceDX new test build w/source push/pull. More info at  &amp;  #TDX17 #DF17",info
"Removing old hub org or non-scratch org from Salesforce DX org list  #salesforcedx",info
"Salesforce DX: The modern way to build on the Salesforce Platform #Salesforce #CRM",info
"Before You Begin (Beta) | Salesforce DX Setup Guide (Beta) | Salesforce Developers",info
"Your earlier #SalesforceDX presentation helped a lot of us to kickstart the pilot.",info
"Salesforce DX  Push to Scratch Org  #SalesforceDX #Salesforce #SalesforceDeveloper",info
"Salesforce DX  Automatically Deploy Apex and Visualforce  #Salesforce #SalesforceDX",info
"Ill be talking in the Dev Theatre at 5pm with  about #SalesforceDX #SalesforceTours",info
"Call out to all SalesforceDevs don't miss the event of the year #TrailheaDX  #TDX17",info
"Around the Web - 20170407 - #Apple #Around the Web #Salesforce #SalesforceDX #WebVR",info
"Salesforce DX goes Open Beta after #TDX17 keynote shortly. Sign up here   #SFDX #li",info
"Salesforce DX  Push to Scratch Org   #Salesforce #SalesforceDeveloper #SalesforceDX",info
"Part II - #SalesforceDX Tutorial - upgrading to Beta fixing issues pulling Profiles",info
"Check out our new article: Salesforce DX  Creating Things  #SalesforceDX #Salesforce",info
"Call out to all SalesforceDevs don't miss the event of the year #TrailheaDX   #TDX17",info
"Salesforce DX - Push to Scratch Org - #Salesforce #SalesforceDeveloper #SalesforceDX",info
"Salesforce DX  Push to Scratch Org -  #Salesforce #SalesforceDeveloper #SalesforceDX",info
"Time to move on to #salesforcedx.. Interesting session ahead... New learning ahead..",info
"Around the Web - 20170407 -  #Apple #Around the Web #Salesforce #SalesforceDX #WebVR",info
"Check out our new article: Salesforce DX  Static Resources  #SalesforceDX #Salesforce",info
"Wondering what's the SalesForce Dx is all about at #TrailheadDX executive program....",info
"Announcing the open beta of Salesforce DX - enabling you to build apps faster  #TDF17",info
"Salesforce DX - Continuous Integration and Continuous Delivery  Salesforce Developers",info
"Salesforce DX  Setup Jenkins  Jenkinsfile   #Jenkins #Salesforce #SalesforceDeveloper",info
"Just published a new article: Salesforce DX  Automatically Deploy Apex and Visualforce",info
"Salesforce DX is an entirely new way to develop on the Salesforce Platform. Learn more:",info
"Salesforce DX  Push Changes To Dev Hub   #Salesforce #SalesforceDeveloper #SalesforceDX",info
"If we want to start using npm packages we should probably get one set up  #SalesforceDX",info
"Meet Salesforce DX the Modern Way to Build on the Salesforce Platform - Now in Open Beta",info
"Salesforce DX - Setup Jenkins -  #Jenkins #Salesforce #SalesforceDeveloper #SalesforceDX",info
"Check out our new article: Salesforce DX  Push Changes To Dev Hub  #Source #SalesforceDX",info
"Evaluating  2.0 with #SalesforceDX for parallel Continuous Integration: jet-heeled #SDLC",info
"Meet #SalesforceDX the Modern Way to Build on the Salesforce Platform - Now in Open Beta",info
"Salesforce DX  Jenkins  Jenkinsfile Revisited  Brett #Salesforce  #SalesforceBlogs #Sales",info
"Salesforce DX  Jenkins  Jenkinsfile Revisited   #Jenkins #Salesforce #SalesforceDeveloper",info
"Salesforce DX  Jenkins  Environment Variables   #Jenkins #Salesforce #SalesforceDeveloper",info
"Salesforce DX - Push Changes To Dev Hub -  #Salesforce #SalesforceDeveloper #SalesforceDX",info
"Read about Ebury's participation in the #SalesforceDX pilot with a practical example from",info
"#SalesforceDX is focused today on pro developer. Allows us to build the foundation for Ad",info
"Environments are easily created and disposable - Salesforce DX   #TDX17 #dev #programming",info
"Salesforce DX  Automate Front End Tasks with Gulp   #Gulp #Salesforce #SalesforceDeveloper",info
"Just published a new article: Salesforce DX  Push to Scratch Org  #SalesforceDX #Salesforce",info
"Meet #SalesforceDX the Modern Way to Build on the Salesforce Platform - Now in Open Beta by",info
"Salesforce DX is an entirely new way to develop on the Salesforce Platform. Learn more:   #",info
"Selenium and SalesforceDX Scratch Orgs  Bob Buzzard #Salesforce  #SalesforceBlogs #Salesfor",info
"Check out our new article: Salesforce DX  Automate Front End Tasks with Gulp  #SalesforceDX",info
"and  are leading us down the #SalesforceDX trail during #DevTrails at Partner Forum London.",info
"Unlock the power of #SalesforceDX with our practical guide to source control for #Salesforce",info
"Stoked to be presenting Managed Packages in Salesforce DX today at #TrailheaDX #SalesforceDX",info
"Dude.  Heads up next time so we can throw together a MN dev group meetup around SalesforceDX",info
"Salesforce DX Static Resources -  #JavaScript #Salesforce #SalesforceDeveloper #SalesforceDX",info
"Salesforce DX  Using Existing Source   #Salesforce #SalesforceDeveloper #SalesforceDX #VueJS",info
"Salesforce DX - Static Resources - #JavaScript #Salesforce #SalesforceDeveloper #SalesforceDX",info
"SalesforceDevs: Announcing the open beta of Salesforce DX - enabling you to build apps faster",info
"Introducing the Salesforce DX Open Beta  Wade Wegner #Salesforce #SalesforceBlogs #Salesforce",info
"Salesforce DX - Using Existing Source -  #Salesforce #SalesforceDeveloper #SalesforceDX #VueJS",info
"#SalesforceDX talk at #SalesforceTours with . Thanks to everyone who had attended. Slides here:",info
"Nice  Developer love new trail Get started with Salesforce DX learn deployments CI scratch orgs",info
"Build Together And Deliver Continuously With #SalesforceDX #salesforcedxcontinuousdelivery  via",info
"Introducing the Salesforce DX Open Beta -- #SFDX now avail in all Ent/Unlimited Production Orgs",info
"Salesforce DX Breakout Room 2 at 2:15 Salesforce Identity: One Customer Many Touchpoints #TDX17",info
"Generate and set Credentials for Scratch Orgs for ForceCode ( Plugin) (Powershell) #SalesforceDX",info
".'s heart rate sensor app was the result of a victory at  #Toronto 2013 __  #startups #wearables",info
"Now the big question is what kind of JavaScript should I use to access all those remote actions?",info
"Meet Salesforce DX the Modern Way to Build on the Salesforce Platform - Now in Open Beta  -  via",info
"TrailheaDX Keynote features how  will use  #SalesforceDX to Build Deploy &amp; Test in Real Time:",info
"The #SalesforceDX Summer '17 release notes have a lot of good information including known issues.",info
"Presenting at CT  UG tonight -VF to Lightning -Einstein Vision -New dev experience w/ SalesforceDX",info
"#Salesforcedx is about to go in public beta. Blaze your trail to an enhanced Developer Experience:",info
"#SalesforceApexHours :- SalesforceDX  By   DATE:- JUNE 10 2017 11:00 AM EST #FarmingtonHillsSFDCDug",info
"salesforce: Salesforce DX is an entirely new way to develop on the Salesforce Platform. Learn more:",info
"Around the Web 20170707   #Lightning #PlatformEvents #Salesforce #SalesforceDeveloper #SalesforceDX",info
"If you are in #Boston today then don't forget to join us for #SalesforceDX discussion.  #Salesforce",info
"Ms control a los desarrolladores con el _ltimo lanzamiento de #SalesforceDX #Madrid  Aqu_ el evento:",info
"Meet #Salesforce DX the Modern Way to Build on the Salesforce #Platform - Now in Open #Beta | #TDX17",info
"1.7.9.4 released with full support for Summer '17   #SalesforceDevs #ForceDotCom #DF17 #SalesforceDX",info
"Watson Learns to See Food: Introducing the Watson Visual Recognition food model #architecture #Watson",info
". beta -  - no more org but code drive - scratch orgs - open &amp; standard developer UX #TrailheadDX",info
"Look what  and I will be doing at #TrailheadDX.  A lot of #CumulusCI #mrbelvedereci and #SalesforceDX",info
"#Salesforce #sfdc #sfdc_pune #heroku #salesforceDX maintain multiple environments and deployment flow",info
"Learnigs are everywhere here I am learning about the CLI Commands available in SalesforceDX by  team.",info
"Considerations for Salesforce DX (Beta) | Salesforce DX Developer Guide (Beta) | Salesforce Developers",info
"Salesforce DX - Setup Jenkins - Jenkinsfile -  #Jenkins #Salesforce #SalesforceDeveloper #SalesforceDX",info
"Automating the ImpOSSible from #TrailheaDX is now online.  #CumulusCI + #mrbeveldereci + #salesforcedx",info
"Salesforce DX will change everything when it comes to #Salesforce Development. ( and Raj Advani on the",info
"I believe any developer/architect of any level should touch code to stay current. Case and point  is VP",info
"So  just confirmed to me that they will release a patch to #SalesforceDX beta to support Person Account",info
"Next Thursday @ 1:30pm learn how we use #CumulusCI #mrbelvedereci #sfdx and  to build OSS managed packag",info
"For #SalesforceDX Pilot participants here is an interesting trick to remove your old dev hub orgs thanks",info
"Meet Salesforce DX the Modern Way to Build on the Salesforce Platform - Open Beta - Salesforce Blog  via",info
"100+ attendees at today's #Ahmedabad #Salesforce dev #meetup. After fun ice breaker session  starting of",info
"I used #SalesforceDX which means all my code was externalized I tested using scratch orgs &amp; deploy us",info
"Salesforce DX Democratizes Coding via Heroku Tools and Einstein AI-Powered CRM Apps | IT Connection Blogs",info
"Introducing #SalesforceDX Open Beta w/  talking abt #VersionControl test w/ #ScratchOrgs Integrate w/ any",info
"Dear  if someone can 1. find a product on ur site &amp; 2 understand the pricing model () give him a medal",info
"Salesforce DX - Jenkins - Environment Variables -  #Jenkins #Salesforce #SalesforceDeveloper #SalesforceDX",info
"Salesforce DX - Automate Front End Tasks with Gulp -  #Gulp #Salesforce #SalesforceDeveloper #SalesforceDX",info
"Session by    Salesforce Developer Meetup #Ahmedabad #Salesforce DX #SalesforceDX #SFDX # #SFDC #learnings",info
"Salesforce DX - Jenkins - Jenkinsfile Revisited -  #Jenkins #Salesforce #SalesforceDeveloper #SalesforceDX",info
"Meet Salesforce DX the Modern Way to Build on the Salesforce Platform - Now in Open Beta  - Salesforce Blog",info
"We built a developer-specific agenda for #DevTrails at our #SalesforceEssentials events. Here's  presenting",info
"Salesforce DX is the new #app development ecosystem launched at #Dreamforce 2016. What is in it for devel..",info
"Blaze Your Trail: Build Customer Apps Peoolle Love #AI #Einstein #SalesforceDX TDX17 #Trailhead #EventDriven",info
"Asked where it all runs... #Einstein - mostly Heroku Trailhead Salesforce DX Open beta - mostly  #TrailheadDX",info
"Salesforce TrailheaDX:17 Recap Highlights and way forward. Salesforce DXPlatform events Einstein and use-cases",info
"Adios #tdx17 had a great time and looking forward to #SFDC17 (November 6-9) #SalesforceDX #Salesforce #Trailhead",info
"SalesforceDevs: Learning how to create apps that customers love with #SalesforceDX #Lightning and #Wave at #DevTr",info
"Learning how to create apps that customers love with #SalesforceDX #Lightning and #Wave at #DevTrails. Take the n",info
"Open Beta for #SalesforceDX #TDX17 #TrailheaDX  Version control = source of truth VC your Code Config Metadata Co",info
"Just added #docker automated build simkim/salesforcedx and simkim/salesforcedx-gitlab-ci  still WIP #salesforcedx",info
"Venue finalized for next #ahmedabad #salesforce developers meetup. Join us to learn more about #SalesforceDX &amp;",info
"Learning how to create apps that customers love with #SalesforceDX #Lightning and #Wave at #DevTrails. Take the ne",info
"SalesforceDevs: vlocity sharing their story how Salesforce DX is empowering their developers to create apps that c",info
"Salesforce News: Introducing the Salesforce DX Open Beta - I am pleased to announce the launch of the Salesforc...",info
"#Force.com Blog: Introducing the Salesforce DX Open Beta - I am pleased to announce the launch of the Salesforc...",info
"Learning how to create apps that customers love with #SalesforceDX #Lightning and #Wave at #DevTrails. Take the ne_",info
"vlocity sharing their story how Salesforce DX is empowering their developers to create apps that customers love_  #",info
"Looks like the JSON format changed in the SalesforceDX CLI this broke Clicks Not Passwords.  A fix has now been pushed to github.",info
"When #SFDX goes GA there will be no excuse for Salesforce projects of any size to not use source control and build automation.   #TDX17",info
"Today I'm most interested in stuff related to #salesforcedx and I'm sure I'm not alone. #TDX17 sfdx force:project:create -n MyTDXProject",info
"Salesforce DX - Open Beta Ready! Get started today:",info
"Kick-start of #salesforcedx session by   on  event.",info
"Introducing the  DX Open Beta - Developer Relations",info
"How to unwind your org for #SalesforceDX #HappySoup",info
"Introducing the Salesforce DX Open Beta  courtesy of",info
"Next generation packaging introduced by salesforceDX",info
"Another interesting session on the way #SalesforceDX",info
"Free Debugger for #Salesforce Unlimited Edition - by",info
"Introducing the Salesforce DX Open Beta - Developer Relations",info
"Curious how  will incorporate #SalesforceDX into their application",info
"Go  partner  on stage at #TDX17 and early adopter of Salesforce DX",info
"Relaxing after #TDX17 with the #SalesforceDX team. #panoramicSelfie",info
"Darn! Getting error going through  #SalesforceDX trail. Following instructions for setting this up. :( Ca",issue
"Oh! Still quite far for Second Generation Packaging! I think I will sign up for another pilot. I liked the",issue
"Short term pain for a big payoff later on. Have some work to do for #SalesforceDX but looking forward to results!",issue
"It is hard to separate monolithic CRM ORGs to artifacts Salesforce DX Development Model badge on",issue
"I guess it will be hard to convince people in 2017. Even if its a requirement for #SFDX....",issue
"Internet connection issues at #TDX17 just for my most expected workshop: Salesforce DX and CI :(((",issue
"On the App Dev w/ Salesforce DX module. Issues w/ opening the scratch org.  Just a matter of time or did I miss som",issue
"#FML for not doing this trailhead module earlier on #SalesforceDX maybe i wouldn't have effed up my deployment __",issue
"Dear  Einstein pls find the list of possible packages (Closed group nodes) my production org can have #SalesforceDX #TrailheadDX",issue
"We are aware of the pain of changing field names when referenced in Apex. Not on roadmap at the moment but looking to improve with #SFDX",issue
"Deployment with ANT migration tool today was a headache. So ready for #SalesforceDX.",issue
"For the life of me I can't figure out how to get  to work in . It's so utterly confusing.",issue
"But there has to be an easier way to deploy to the Hub Org so there are fewer manual steps",issue
"I haven't done this trailhead but I think the openssl stuff was easier with the Bash on Ubuntu",issue
"I am pre-tty sure I did something wrong. Yet the way #SalesforceDX tries to tell me that seems unhelp",issue
"What is #SalesforceDX?",question
"How #SalesforceDX works?",question
"#SalesforceDX open beta",question
"#icloudcode #SalesforceDX",question
"#SalesforceDX Does this help Wade? :)",question
"Welcome Salesforce DX - now in open Beta!",question
"SalesforceDX... Interesting one... Things to expect..",question
"Wait what's this? #SalesforceDX cupcakes? Nom nom nom!",question
"Blooming nuts? Sorry are we talking about  or #SalesforceDX?",question
"Ohh  - Salesforce DX is in open beta more power to the Devs!",question
"How to handle the change to Salesforce DX project format?  #sfdx",question
"Any  looking for a Friday challenge?:   #salesforcedx #salesforce",question
"So it is in line with the SalesforceDX names  #Salesforce #SalesforceDX",question
"Developers/CTOs | Like  DX ? try Salesforce DX Open Beta  - merci   #TDX17",question
"Can you explain the trouble you've had a bit more? And no SalesforceDX has not",question
"Wana try out #SalesforceDX? hit github for some sample repo given by Salesforce",question
"Miss  &amp; 's talk on migrating to #SalesforceDX? No worries this  module covers it:",question
"Everyone wants to know about #SalesforceDX and #ContinuousIntegration! Are you here? #TDX",question
"Announcing the open beta of Salesforce DX - enabling you to build apps faster  #TDF17  #Sal",question
"Interested to learn more about #SalesforceDX at #TDX17? Check out this guide and join us live!",question
"So who else is just stupid excited about Salesforce DX? Scratch orgs? CLI? Be still my _ #TDX17",question
"The start to a great session by  at #TDX17 on Modern Application Development #SalesforceDX #SaaS",question
"Curious to know more about #SalesforceDX? Join us tomorrow 11AM EDT. #SalesforceApexHours #Ohana",question
"Which part of #salesforcedx are you most interested in? Easier source controlling? Scratch orgs?",question
"Are y'all picking up what I'm putting down? Well-said !! Lots of goodness with Salesforce DX! #TDX17",question
"Help me test this slack integration? Please tweet to #SalesforceDX for the next few minutes.question",question
"#SalesforceDX is in beta now. No more to be a pilot user to access it. The best gift to all  . Go ge",question
"Want to update tab permissions? Try this neat tip by  on how to use #SalesforceDX - Specifically the",question
"How do  &amp; Apprenda simplify developing on the cloud for new &amp; existing .NET apps? The answer:",question
"Want to know more about #SalesforceDX? Head to  and check out the Get Started with Salesforce DX trail.",question
"So ya want to be a CLI Ninja and create your own plugins for #SFDX CLI?  Come to my talk at #TrailheaDX",question
"Wanna know more on Lightning Testing Service and #SalesforceDX ?  wrote a great blog post just for you !",question
"Pass the  challenge w/o opening your TPO? Use #SalesforceDX. Write your code in Scratch Org. Pull source.",question
"My questions so far about #SalesforceDX Can an object or field be part of more than on artifact? #askforce",question
"Omg why isn't this more talked about? This is just what #LEX has needed -- this with #SalesforceDX is amazing",question
"Managed Packages in Salesforce DX and Feature Management from #TrailheaDX #SalesforceDX WARNING: Features me!",question
"Want to learn how to practice safe SaaS w/ Salesforce Sandboxes? Join  &amp; me at #TrailheadDX #SalesforceDX",question
"Why do we convert the source? Metadata API source was never designed for developers to work with. #SalesforceDX",question
"Curious about the features and org preferences supported by #SalesforceDX scratch orgs? Take a look at the docs:",question
"Going to #TrailheadDX? Join me to learn howto Boost Developer Productivity with #SalesforceDX CLI Customized Tools",question
"Hey  will #SalesforceDX be open for beta at 28 June for the community? P.S. I didn't intend to the pilot program :(",question
"Excited at the potential of #SalesforceDX? Now's the time to get your #Salesforce version control strategy in place",question
"_ I'm LIVE with a tour of the #TDX17 expo hall! Have questions? Let me know! #SalesforceDX #EqualityForAll #Salesfo",question
"SalesforceDX - any other admins out there who are stoked about ditching change sets? This is going to be amazing #TDX17",question
"#SFDX Can I get a security token for a scratch org / manipulate IP login ranges using dx cli? want 2 connect  to scratch",question
"No time to walk the expo? We also have a session on Thursday.  Data for Salesforce DX with Odaseva  #TDX17 #TrailheaDX cc",question
"WAIT Hold UP Hold the phone Did #salesforceDX detect the metdata change???? Can it detect any change? #holyshit #TrailheaDX",question
"Is there a fast way to generate many fields with #SalesforceDX?  I'm currently doing some *nix command shenanigans to do so.",question
