"Just Earned the Salesforce DX Development Model Badge!",badge
"Just earned the Salesforce DX Development Model badge on",badge
"Just earned the App Development with Salesforce DX badge on",badge
"Just earned the Continuous Integration Using Salesforce DX badge on",badge
"Just earned the Salesforce DX Development Model badge on !   first few?",badge
"This was fun! Just earned the App Development with Salesforce DX badge on !",badge
"Just earned the Salesforce DX Development Model badge on  and you should too!",badge
"Just earned the App Development with Salesforce DX badge on  and you should too!",badge
"Just earned the Git and GitHub Basics badge on .  Completed Get Started with Sales",badge
"#MyTrailAhead Just earned the Salesforce DX Development Model badge on #Trailhead  via",badge
"Just earned the Continuous Integration Using Salesforce DX badge on  and you should too!",badge
"#MyTrailAhead Just earned the App Development with Salesforce DX badge on #Trailhead ! via",badge
"Loving DX... Just earned the Salesforce DX Development Model badge on  and you should too!",badge
"Another $10 donation to . #TDX17   Just earned the Salesforce DX Development Model badge on !",badge
"Just earned the Continuous Integration Using Salesforce DX badge on  and you should too!  #TDX17",badge
"#MyTrailAhead Just earned the Continuous Integration Using Salesforce DX badge on #Trailhead   via",badge
"Just earned the Continuous Integration Using Salesforce DX badge on  ! (do the steps and set up CI!)",badge
"Foundation is strong - Just earned the Salesforce DX Development Model badge on  and you should too!",badge
"Just earned the #SalesforceDX Development Model badge on  and you should too! #TDX17 #Trailheadx",badge
"Just won the #Salesforce DX Development Mode badgel on  ! #SalesforceDX is exactly what I needed.",badge
"earned the App Development with Salesforce DX badge on  despite DX riddled with errors",badge
"You too should get the taste of packaging v2 in App Development with Salesforce DX badge on",badge
"Exciting #salesforcedx is almost here!  Open Beta!  Great tool for devs (&amp; help stop clashes with admins teams)!",excitement
"#AwesomeAdmins READ THIS NOW about #SalesforceDX it explains everything you need to know.  THIS IS EVERYTHING.",excitement
"I'm an #AwesomeAdmin and I earned a #SalesforceDX badge.  I've come a long way and proud that I understand this for",excitement
"Thx! Here we go then:",excitement
"Its beta day!!",excitement
"My baby is growing up!",excitement
"rocking SalesforceDx demo",excitement
"#salesforcedx! Lovin' this!",excitement
"Happy to help  ! #SalesforceDX",excitement
"This looks SWEET! #SalesforceDX",excitement
"Can't wait to try it out! #SFDX",excitement
"#SalesforceDX open beta out now!",excitement
"Awesome session on #salesforcedx",excitement
"Finally #SalesforceDX is in beta:",excitement
"Asking for a friend #SalesforceDX",excitement
"#TDX17  SalesforceDX Open Beta !!!",excitement
"Congrats on a highly successful #TDX17 Wade! You and the team had attendees super excited about #SalesforceDX!",excitement
"#SalesforceDX CI/CD sweetness #TDX17",excitement
"Don't miss the intro to #SalesforceDX!",excitement
"Many more uses of the #SFDX sure to come",excitement
"Salesforce DX at Summit Theater!! #TDX17",excitement
"En el  al fin! :D Ahora con #SalesforceDX",excitement
"Thanks for being a #salesforceDX partner!",excitement
"Lightning !!! Always draws a crowd #Tdx17",excitement
"Just created my first scratch org!  #TDX17",excitement
"Created bunch of Scratch orgs today  rocks",excitement
"Amazing   #SalesforceDX demo by .   #TDX17",excitement
"#SFDX and all I'm still trying to catch me a",excitement
"Intro to #SFDX with  - I love Code :) #TDX17",excitement
"Let the fun begin! #TrailheaDX #salesforcedx",excitement
"This is going to change how we cloud code in",excitement
"Scratch Org lovely feature from #SalesforceDX",excitement
"Open Beta finally! #SalesforceDX #TrailheadDX",excitement
"Thievery rocking out #TrailheaDX #SalesforceDX",excitement
"Tune in now! -   presenting at  DX conference.",excitement
"Exciting times for ! #salesforceDX Open Beta -",excitement
"Excited to start building  with Salesforce DX!",excitement
"Woohoo! Introducing the Salesforce DX Open Beta",excitement
"The Salesforce DX Beta is here!  awesome work !",excitement
"Aw! Love those! #TDX17 #SalesforceDX #DallasSFDC",excitement
"Can't wait to integrate #SFDX into my repertoire!",excitement
"#salesforcedx is now open to anyone - try it out!",excitement
"Introducing the Salesforce DX Open Beta!   #TDX17",excitement
"SalesforceDX developer org has autocomplete! #TDX17",excitement
"Can't wait to use Salesforce DX!! #TDX17 #salesforce",excitement
"#SalesforceDX is here! Time to have some fun with it!",excitement
"We have some amazing  modules coming for #SalesforceDX!",excitement
"Introducing Salesforce DX Open Beta! #GitItCodey #TDX17",excitement
"Introduction to #SalesforceDX  with  should be fun! #TDX17",excitement
"Awesome SalesforceDX demo. Thank you Allison Leong! #TDX17",excitement
"dropping SalesforceDX beta at #tdx17  - wow! rock star team",excitement
"#SalesforceDX session by  in the #TDX17 Summit Theater is EPIC!",excitement
"Thanks for the help with the #SalesforceDX tag. We're good to go!",excitement
"Introducing Salesforce DX Open Beta !! #ContinuousDelivery #TDX17",excitement
"Hi ! We're at #DallasSFDC waving back at ya! #SalesforceDX #TDX17",excitement
"The day has arrived!! #CI on the  platform #SalesforceDX    #TDX17",excitement
"It is matter of time before we get #SalesforceDX out in the wild !",excitement
"This is so dope! Testing automation for #SalesforceDx Scratch Orgs!",excitement
"Nice! #SalesforceDX trailhead courses are now available! #TrailheaDX",excitement
"BEST NEWS EVER: #salesforcedx public beta in two weeks!!! #DevTrails",excitement
"Sharing #salesforcedx with the Dutch salesforce architect community!",excitement
"Salesforce DX open beta... Now! It will be great to use it at  #TDX17",excitement
"The latest Digital Identity Management News!  Thanks to  #salesforcedx",excitement
"Woot woot! Introducing the Salesforce DX Open Beta - Developer Relations",excitement
"Cool! We're excited to have Scott of  visit  this week to learn more abou",excitement
"SalesforceDX!  Looks like a good way to manage and deploy without all the",excitement
"Think big! Scale your #businessrules solutions up to the world of #bigdata",excitement
"Amazing job introducing the #SalesforceDX open beta ! ________ #TrailheaDX",excitement
"I am pleased to introduce the #SalesforceDX open beta today at #TrailheaDX!",excitement
"Standing Room only for  session Intro to Salesforce DX!! #TrailheadDX #TDX17",excitement
"I can't wait to see the amazing #SalesforceDX CLI plugins  is going to build!",excitement
"Let's try this recipe for #SalesforceDX when we go home!!  #TDX17 #salesforce",excitement
"Scratch orgs for testing and version control w/ beta #Salesforce DX!!! _______",excitement
"DX public open beta! Smooth that org itch with scratch orgs!  #TrailheadDX #CI",excitement
"Excited that the #SalesforceDX beta is now live! Looking through the docs now:",excitement
"Likewise! Great to have the #SalesforceDX team represent at London #devtrails!",excitement
"The focus of  was largely  and  and his team had a big part to play. Nice work!",excitement
"Yes time flies! Before you know ... #TrailheaDX and the #SalesforceDX open beta!",excitement
"Awesome command line demo by  at  such a great event ! #Salesforce #SalesforceDX",excitement
"The latest Microsoft Azure Cloud Platform!  Thanks to  #salesforcedx #trailheaddx",excitement
"shows us how to build together and deliver continuously with #salesforcedx #TDX17",excitement
"Great event party venue and great DJ! Bands about to come on. #TDX17 #SalesforceDX",excitement
"DEVELOPERS DEVELOPERS DEVELOPERS!  __ Einstein  _Lightning _ Salesforce DX  #TDX17",excitement
"A great hands-on post of #SalesforceDX! (Thank goodness for in-browser translation!)",excitement
"Salesforce DX open beta is right here.  DO WHAT  SAYS AND GET IT GOING TODAY! #TDX17",excitement
"Introducing the Salesforce DX Open Beta - Developer Relations &gt; go get your copy!",excitement
"A real tool for  ! Check out this new trail to get familiar with #SalesforceDX #TDX17",excitement
"If you missed our DemoJam do not worry here it is! #TDX17  #SalesforceDX #TrailheadDX",excitement
"Nice! Folks really wanted in the DX beta! I'll try to pop by. I'm across the street @",excitement
"&amp; our Customer panel Salesforce DX Analyst Session; Killing it gentleman !! #TDX17",excitement
"Most impressive to see how deeply  has integrated #SalesforceDX into their product! #TDX17",excitement
"Great post ! I'm itching to take it to a repo with #SalesforceDX! Maybe some CI tests too.",excitement
"Cool sitting next to  watching the amazing SalesforceDX launch while he works on his  IDE!",excitement
"Je viens de gagner le badge Salesforce DX Development Model sur  et je vous le recommande !",excitement
"DEVELOPERS DEVELOPERS DEVELOPERS! Einstein Lightning Salesforce DX #TDX17    DEVELOPERS DEV",excitement
"#CumulusCI is now switched over to the #salesforcedx beta.  Thanks to   for the contribution",excitement
"A great set of #SalesforceDX posts by . Yay! It works! Conclusion: This has been cool so far.",excitement
"Really looking forward to Platform Events and Salesforce DX!! Lots to take in at #TrailheaDX17",excitement
"I have so many inspirational women to look up to at ! Loving watching  presenting #SalesforceDX",excitement
"#SalesforceDX support in Illuminated Cloud looks promising looking forward to trying it soon! -",excitement
".: you're not done with me yet I've got these boots on I'm going to work this stage! Announcing",excitement
"what an amazing Milano&amp;Cagliari DUG Meetup! thank you guys!  #salesforcedx #summer17 #gnite",excitement
"The #SalesforceDX pilot finishes in a couple of weeks - how time flies when you are having fun!",excitement
"Day 2 of #TDX17 and attendees can't get enough of Salesforce DX and .  Standing room only again!",excitement
"Full crowd to hear about Continuous Integration and Continuous Delivery with #SalesforceDX from !",excitement
"At last commands! Ebury's SF Team Lead  explains how #SalesforceDX will change your life.  #TDX17",excitement
"#TDX17 Salesforce DX is great! Had privilege to pilot it! Source ctrl scratch orgs packaging blendin",excitement
"This is an amazing milestone for  - thank you to the entire #salesforcedx team for making it happen!",excitement
"BOOM! Source pushed in VS Code on Save as  shows how to use #SalesforceDX CLI in the context of IDE!",excitement
"Finally! #Salesforce now has an open beta for SalesforceDX! Can't wait to finally start trying it out",excitement
"SalesforceDX in beta &amp; a new #Trailhead Get started with SalesforceDX this is awesome for all  !!",excitement
"I am lovin' on !  She's blowing minds at #TDX17 showing the insane power of SalesforceDX! #YouFeelinMe",excitement
"Ha! I guess that is accurate. While I was going for fear I'm still very positive about SalesforceDX :)",excitement
"Thanks for sharing the knowledge and vision together with your team. Great interactions! #salesforcedx",excitement
"Rockstar and Engineering Lead at Pure Storage  talks to us about stuff I cant talk to YOU about! &lt;3",excitement
"WOOHOO! #LaunchDay #SalesforceDX Open Beta! Changing the way developers can build apps on the  platform",excitement
"Funny. Our team slack bot monitors #sfdx for #SalesforceDX and you're definitely keeping us busy today!",excitement
"DX allows you to version control your own code. Edit JSON settings and crate a scratch org. COOL!!! Get:",excitement
"Open Beta! Get #SalesforceDX | Build Together with #Git and Deliver Continuously | #SalesforceDevelopers",excitement
"I just checked my session at #dreamOle17 is online now. #SalesforceDX demo in Spanish. Very good work  !",excitement
"You can download Salesforce DX open Beta after the keynote! CI =building awesome apps together.  knows al",excitement
"Three MOAR  module badges to earn!  Salesforce DX is pretty cool. Working through that trail. 2 mo' modul",excitement
"Open Beta of Salesforce DX now available! Your source control now the source of truth! Get it while it's hot!",excitement
"I just sent you a PR for a manifest file. Using my #SalesforceDX plugin makes this incredibly simple to share!",excitement
"Oh thank you! It was a thrill for me to be able to connect with you again. (And geek out about #SalesforceDX...)",excitement
"Great to see the Salesforce DX process also backward compatible to current managed packages. Nice job  and team!",excitement
"Amazing Session by   on #SalesforceDX . At Last I have someone to guide me about it. Really Cool feature!! Thanks",excitement
"Going through some great trailhead modules related to Salesforce DX! Excited about new paradigm of development ___",excitement
"Pic from talk yesterday. 24 chairs estimate we had about ~90 attendees! Excited about the excitement!#SalesforceDX",excitement
"Listening to Dileep Burki talking about Second Generation Packaging #SalesforceDX #TDX17 Exciting times! So many ne",excitement
"SalesforceDX Beta is here! I am at #TrailheaDX this week and would love to meet users for both DX and Platform Cache",excitement
"saying boom! and mind blown! so many times I want to go home to start using Salesforce DX Vlocity and Einstein! #TDX17 #dev",excitement
"It's been awesome to watch all the #SalesforceDX tweets and posts to the success channel over the holiday. Keep them coming!",excitement
"Thank you!  I'm going to try and conquer the other #SalesforceDX badges as well.  I want to understand this and know the power.",excitement
"Lots of fantastic tweets about #SalesforceDX today! Looks like folks are having a lot of fun at the #salesforceworldtour London!",excitement
"Having an amazing time at #TDX17! Tons of free swag a concert and I built my first app all within the first two hours.... #salesforcedx",excitement
"Salesforce DX Platform Events custom push notifications Big Objects dynamic Lightning pages...#TDX17 so many presents! U shouldn't have!",excitement
"This is going to be a pretty exciting week. I hope you got enough rest this weekend -- you're going to need it! #SalesforceDX #TrailheaDX",excitement
"Was watching demo of SalesforceDX at #TDX17 via stream while waiting for scratch org to spin up. Been using it for a while - it's awesome!",excitement
"#SalesforceDX enters beta from pilot stage today! Making small yet important strides in #Salesforce CI space! More to come at #Trailheadx !",excitement
"API Explorer CI &amp; CD thx to #salesforcedx  &amp; open Metadata API #Forcedotcom is now looking the powerful PaaS platform it was meant to be!",excitement
"Take away from Awesome #TDX17 #tdx2017   get more certified  get more badge  keep learning ......#salesdevelopment #salesforcedx",excitement
"Seeing #SalesforceDX evolving from dev preview through pilot to beta is amazing. So much _ for . Amazing job",excitement
"The possibilities with Salesforce DX are amazing. I've built CI solutions before and they've always been fragile.",excitement
"It's pretty cool that #salesforcedx scratch orgs are created leveraging platform events /event/OrgLifecycleNotification",excitement
"Enough playing around with the #SalesforceDX bot. I realized I wouldn't be able to sleep with a sleep().sleep(1) statement in the code.",excitement
"Amazing expatiation on CLI and version controls #SalesforceDX",excitement
"Amazing keynote by  yesterday at #TDX17. Her enthusiasm is contagious. Can't wait to get my hands into",excitement
"Finally spent some time on #salesforcedx pilot today and thanks to  for the amazing demos in #salesforcedx pilot kick off webinar",excitement
"Whoa.  being Wade with #Salesforcedx #tdx17 GO GET IT",excitement
"Weekend plans:. 1) Patch my driveway.  2) Setup #SFDX",excitement
". and team killin this live demo @ #TDX17 #SalesforceDX",excitement
"#salesforcedx #TDX17 #RELEASE #Salesforce Love the product",excitement
"Very cool....Introducing the Salesforce DX Open Beta #salesforce",excitement
"ISVs will love Feature Toggles of #Packaging2 coming with #SFDX.",excitement
"Everyone is so excited and want to hear more about #SalesforceDX",excitement
"About to start an interesting session on #SalesforceDX by  &amp;",excitement
". financial loves  and our #eSignature #API. #TDX17 #SalesforceDX",excitement
"Why  will love #salesforcedx NKOTB reference ha ha",excitement
"Really excited to :: Get Started with Salesforce DX",excitement
"Happy to see that all our manual work can get automated with #SalesforceDX",excitement
": There has never been a better time to be a Salesforce developer:  #TDX17",excitement
"Sorry forget to mention... big thanks to  and  #SalesforceDX #SalesforceTour",excitement
"Had a cool demo of 's #SFDX integration at  meetup tonight with creator Scott Wells",excitement
"You're going to want this URL. Go ahead take a picture.   #SalesforceDX #TrailheaDX",excitement
"Aside from the #SalesforceDX beta Platform Events is my favorite #Summer17 feature.",excitement
"salesforce: There has never been a better time to be a Salesforce developer:  #TDX17",excitement
"There has never been a better time to be a Salesforce developer:  #TDX17  #salesforce",excitement
"Now that I'm understanding what #salesforceDX is the cooler I think it is.  How come it",excitement
"I've said it before I'll say it again... SalesforceDX is bloomin' nuts. #SalesforceTour",excitement
"The  platform security makes compliance issues easy.    #SalesforceDX makes the SDLC easy.",excitement
"Wish I had subscribed to #SalesforceDX pilot org. So much looking forward to it going live",excitement
"Im excited to dive into more new ways to deliver features for SaaS and product companies w/",excitement
"_ at Salesforce DX. DevOps enabled. Great presentation by Leah #preach _ #TDX17 #TrailheadDX",excitement
"Together with #SFDX the feature I'm most exited about: Introducing the Apex Metadata API  by",excitement
"Thank g-d.  I've got deployment notes sitting on a napkin at my desk right now. #SalesforceDX",excitement
"Getting a gist of #salesforcedx Thanks to  and  for awesome session.. Looking forward to it..",excitement
"I like the way it looks. Reminds me of my favorite game #oregontrail #salesforcedx ;) I'll see",excitement
"The #SFDX and #platformevents demos at #TDX17 have been brilliantly executed.  and  killed it.",excitement
"Exciting keynote &amp;  DX announcements  and team.  Very cool--makes building apps easier and exte",excitement
"sharing their story how Salesforce DX is empowering their developers to create apps that customers love",excitement
"showing off the power of Lightning App Builder to customize metadata and then seamlessly integrate with",excitement
"Finally met  at #TDX17 after so many messages exchanged during the pilot. Congrats for #SalesforceDX bet",excitement
"Every partner that has a product on the  freaking out in excitement for #SalesforceDX #TDX17 #TrailheaDX",excitement
"Others have fun at #TDX17. I had my fun  reaching 100k by doing some of the great new #SalesforceDX modul",excitement
"It's  doing *heavy lifting* made easy with Salesforce DX CLI  #TrailheaDX Summit Theater on 2 starting NOW",excitement
"Scratch orgs CLI force:source:pull... this demo... It just keeps getting better and better #TDX17 #SalesforceDX",excitement
"So glad to finally see an emphasis on CI/CD in the Salesforce world ideally w/ #SalesforceDX but as this article",excitement
"Very informative session Salesforce Apex Hour - #SalesforceDX Thanks a lot   Thank you  for organizing this session.",excitement
"So grt to see what  #SalesforceDX is providing to the crowd #TDX17",excitement
"amazed once more at the poise zeal and interest to learn    #Tdx17",excitement
"Awesome looking forward for it . It will be great to learn more about #salesforcedx",excitement
"Excited for this!  #salesforce #feedly",excitement
"#askforce Let's say you're a dev working with an admin can they access ur scratch org and make customizations w/yo",info
"Next gen packaging",info
"Next topic: SalesforceDX",info
"Open beta for SalesforceDX",info
"#SalesforceDX CLI by  #TDX17",info
"Introducing the  DX Open Beta",info
"Salesforce DX Developer Guide",info
"Get Started with #SalesforceDX",info
"Salesforce DX is in open beta!",info
"Salesforce DX Development Model",info
"Prerequisites for #salesforcedx",info
"#salesforcedx Salesforce DX Beta",info
"Migrating to Salesforce DX:  via",info
"introducing salesforce DX #TDX17",info
"Salesforce DX building together.",info
"Build Together with SalesforceDX",info
"Salesforce DX Open Beta!  #tdx17",info
"Salesforce DX Open Beta is here.",info
"Salesforce DX PlatformDevelopment",info
"Practice safe SaaS  #SalesforceDX",info
"Join the session -  #SalesforceDX",info
"#salesforcedx in open beta. #TDX17",info
"letting us know about #SalesforceDX",info
"Salesforce DX - Setup Jenkins - WIP",info
"Introduction to Salesforce DX:  via",info
"thanks for insights of #SalesforceDX",info
"is started with SalesforceDX session",info
"Agenda for the session #salesforceDX",info
"Introduction to Salesforce DX #TDX17",info
"Getting started with #SalesforceDX by",info
"Like o learn more about #Salesforcedx",info
"Introducing the Salesforce DX Open Beta",info
"Introducing Git Repos and Issue Tracking",info
"What's next for Salesforce DX ... #TDX17",info
"Data for Salesforce DX with Odaseva:  via",info
"Ready to define sauce code at #TDX17 #SFDX",info
"#Selenium and #SalesforceDX Scratch Orgs by",info
"Introducing Salesforce DX Open beta! #TDX17",info
"Demo sfdx by   #salesforcedevs #salesforcedx",info
"Introducing the Salesforce DX Open Beta  via",info
"Git and GitHub Basics   #SalesforceDX #TDX17",info
"and Raj presenting on SalesforceDX #devtrails",info
"Learning how to setup #SalesforceDX at #TDX17",info
"Another new session on SalesforceDX by  team.",info
"Salesforce DX Open Beta! #SalesforceTrailheaDX",info
"PPT and Recording of  session on SalesforceDX!",info
"Version control for:  . Important prep work for #salesforcedx!",info
"Day 2 of #TDX17 underway: getting familiar with Salesforce DX!",info
"Please reply with #SalesforceDX in the tweet so our team sees it!",info
"Here with a few friends at #trailheaDX to talk about #SalesforceDX!",info
"Salesforce DX Open Beta available now! Get started here  #Salesforce #TDX17",info
"The latest Digital Identity Management News!  Thanks to    #cdntech #salesforcedx",info
"If you're participating in the #SalesforceDX beta  make sure to join the Success group!",info
"#SalesforceDX  The X Factor For #SalesforceDevelopers!  #Salesforce #crm SalesforceCom #sfdc",info
"Salesforce DX  Static Resources   #JavaScript #Salesforce #SalesforceDeveloper #SalesforceDX",info
"Salesforce DX making source code the source of truth is a big deal! #TDX17 #dev #programming",info
"Here's more from Day 1 at #TrailheaDX Come meet us tomorrow at our booth! #SalesforceDX #TDX17",info
"#Salesforce DX now available as public beta! Get your new developer experience here:  #TrailheaDX",info
"The Salesforce DX Open Beta Build together and deliver continuously. &gt; get your free beta here!",info
"Everyone can get started with #SalesforceDX for free today! Plus some modules on #Trailhead! #TDX17",info
"Developers area at #SalesforceEssentials. Learning lightning salesforceDX and a lot of  challenges!",info
"Now any developer can activate Dev Hub to make changes in their production environment! Learn more:",info
"Get Started with Salesforce DX | Salesforce Trailhead &gt; new trailhead trail expect more coming days !!",info
"I added a little natural language processing to our team  bot so we'll see how you feel about #SalesforceDX!",info
"A short break and then back to #SalesforceDX and preparations for an amazing #TrailheaDX conference later this month!",info
"Currently hanging out at the Partner Den -- come talk all things apps and AppExchange with us! #SalesforceDX #TrailheadDX",info
"#sfdx pre-BETA is out! first impressions: improvements on scratchorgs management through #ActiveScratchOrg and #ScratchOrgInfo new objs!",info
"Sfdx force:visualforce:page:create -n Contacts -d force-app/main/default/pages",info
"Salesforce DX Open Beta is now available in all production and business orgs.  #teqfocus #teqforce #Salesforce",info
"salesforcedx - This is the _aggregator_ for the various projects in the Salesforc...   #npm #javascript #nodejs",info
"Salesforce DX - Automatically Deploy Apex and Visualforce -  #Gulp #Salesforce #SalesforceDeveloper #SalesforceDX",info
"Salesforce DX announced today as an integral part of integrating the Salesforce Clouds with one another.  #TDX2017",info
"A decomposed Platform Event pulled from my scratch org using #SalesforceDX. Fields are independent files. (Same for",info
"Starting to play around with #SalesforceDX as I was about to spin up new dev org for a new package. Using the Ubuntu files on Windows :P",info
"Using #SalesforceDX CLI you can open a flexipage in the App Builder using this command: sfdx force:source:open -f Page.flexipage-meta.xml",info
"Introducing the Salesforce DX Open Beta  #SalesforceDx",info
"Look it up: Data for Salesforce DX with Odaseva #TDX17",info
"Introducing the Salesforce DX Open Beta  via #Salesforce",info
"Continuous Integration in Salesforce using Salesforce DX",info
"Salesforce DX  Push Changes To Dev Hub  Brett #Salesforce",info
"More from #TrailheaDX 2017 by     #TDX17 #SalesforceDX #AI",info
"Release notes for the #SalesforceDX Beta are available now!",info
